{
  "$schema": "synergy-schema.json",
  "domain": "thermal",
  "subDomain": "apple-silicon-thermal-profiles",
  "lastUpdated": "2026-01-18",
  "lastVerified": "2026-01-18",
  "confidence": "high",
  "sources": [
    {
      "name": "Gemini Deep Research - Apple Silicon Thermal Management",
      "type": "gemini-research",
      "date": "2026-01-18"
    },
    {
      "name": "Apple Silicon Architecture Documentation",
      "type": "official-docs",
      "date": "2024"
    },
    {
      "name": "Independent Thermal Testing",
      "type": "benchmark",
      "date": "2024"
    }
  ],
  "interactions": [
    {
      "id": "m-series-tj-max-threshold",
      "type": "bottleneck",
      "components": ["cpu:apple-silicon", "thermal:junction-temp"],
      "relationship": "Apple Silicon chips have a Tj max around 100-105C with active throttling beginning at 95C to prevent damage",
      "conditions": [
        {
          "parameter": "cpu_temperature",
          "operator": "gte",
          "value": 95,
          "unit": "celsius"
        }
      ],
      "impact": {
        "performance": { "value": -20, "min": -10, "max": -40 },
        "thermal": { "value": 0 },
        "power": { "value": -15 }
      },
      "confidence": "high",
      "applicableTo": ["M1", "M1 Pro", "M1 Max", "M2", "M2 Pro", "M2 Max", "M3", "M3 Pro", "M3 Max", "M4", "M4 Pro", "M4 Max"],
      "tags": ["thermal-limit", "throttling", "tj-max", "cpu"],
      "source": "Apple Silicon Thermal Design",
      "sourceDate": "2024"
    },
    {
      "id": "gpu-thermal-throttle-onset",
      "type": "bottleneck",
      "components": ["gpu:apple-silicon-gpu", "thermal:junction-temp"],
      "relationship": "GPU throttling begins when GPU cluster temperature exceeds 90C, reducing clock speeds progressively",
      "conditions": [
        {
          "parameter": "gpu_temperature",
          "operator": "gte",
          "value": 90,
          "unit": "celsius"
        }
      ],
      "impact": {
        "performance": { "value": -25, "min": -15, "max": -45 },
        "thermal": { "value": 0 },
        "power": { "value": -20 }
      },
      "confidence": "high",
      "applicableTo": ["M1", "M1 Pro", "M1 Max", "M2", "M2 Pro", "M2 Max", "M3", "M3 Pro", "M3 Max", "M4", "M4 Pro", "M4 Max"],
      "tags": ["thermal-limit", "throttling", "gpu", "clock-reduction"],
      "source": "Thermal Testing Data",
      "sourceDate": "2024"
    },
    {
      "id": "fanless-sustained-load-throttle",
      "type": "bottleneck",
      "components": ["thermal:passive-cooling", "cpu:apple-silicon", "gpu:apple-silicon-gpu"],
      "relationship": "Fanless MacBook Air throttles after 10-15 minutes of sustained heavy load as chassis heat-soaks",
      "conditions": [
        {
          "parameter": "workload_duration",
          "operator": "gte",
          "value": 10,
          "unit": "minutes"
        },
        {
          "parameter": "cpu_utilization",
          "operator": "gte",
          "value": 80,
          "unit": "percent"
        }
      ],
      "impact": {
        "performance": { "value": -35, "min": -20, "max": -50 },
        "thermal": { "value": 30 },
        "power": { "value": -25 }
      },
      "confidence": "high",
      "applicableTo": ["MacBook Air M1", "MacBook Air M2", "MacBook Air M3", "MacBook Air M4"],
      "tags": ["fanless", "passive-cooling", "macbook-air", "sustained-load", "heat-soak"],
      "source": "Thermal Testing",
      "sourceDate": "2024",
      "mitigations": [
        "Take breaks during intensive tasks",
        "Use laptop stand for improved airflow under chassis",
        "Avoid direct sunlight or warm ambient environments",
        "Reduce workload intensity for longer sessions"
      ]
    },
    {
      "id": "p-core-thermal-migration",
      "type": "synergy",
      "components": ["cpu:p-core", "cpu:e-core", "thermal:junction-temp"],
      "relationship": "macOS migrates threads from P-cores to E-cores under thermal pressure, maintaining functionality at reduced performance",
      "conditions": [
        {
          "parameter": "cpu_temperature",
          "operator": "gte",
          "value": 90,
          "unit": "celsius"
        }
      ],
      "impact": {
        "performance": { "value": -20, "min": -10, "max": -30 },
        "thermal": { "value": -15 },
        "power": { "value": -25 }
      },
      "confidence": "high",
      "applicableTo": ["M1", "M1 Pro", "M1 Max", "M2", "M2 Pro", "M2 Max", "M3", "M3 Pro", "M3 Max", "M4", "M4 Pro", "M4 Max"],
      "tags": ["p-core", "e-core", "thread-migration", "thermal-management"],
      "source": "macOS Scheduler",
      "sourceDate": "2024"
    },
    {
      "id": "macbook-pro-14-sustained-thermal",
      "type": "synergy",
      "components": ["thermal:active-cooling", "cpu:apple-silicon", "gpu:apple-silicon-gpu"],
      "relationship": "MacBook Pro 14-inch maintains near-peak performance for extended periods with active cooling and larger thermal mass",
      "conditions": [
        {
          "parameter": "ambient_temperature",
          "operator": "lte",
          "value": 25,
          "unit": "celsius"
        }
      ],
      "impact": {
        "performance": { "value": -5, "min": 0, "max": -15 },
        "thermal": { "value": 15 },
        "power": { "value": 10 }
      },
      "confidence": "high",
      "applicableTo": ["MacBook Pro 14 M1 Pro", "MacBook Pro 14 M1 Max", "MacBook Pro 14 M2 Pro", "MacBook Pro 14 M2 Max", "MacBook Pro 14 M3 Pro", "MacBook Pro 14 M3 Max", "MacBook Pro 14 M4 Pro", "MacBook Pro 14 M4 Max"],
      "tags": ["macbook-pro-14", "active-cooling", "sustained-performance"],
      "source": "Benchmark Testing",
      "sourceDate": "2024"
    },
    {
      "id": "macbook-pro-16-thermal-advantage",
      "type": "synergy",
      "components": ["thermal:active-cooling", "cpu:apple-silicon", "gpu:apple-silicon-gpu"],
      "relationship": "MacBook Pro 16-inch has larger thermal mass and fan capacity, sustaining maximum performance longer than 14-inch",
      "conditions": [
        {
          "parameter": "ambient_temperature",
          "operator": "lte",
          "value": 28,
          "unit": "celsius"
        }
      ],
      "impact": {
        "performance": { "value": 5, "min": 0, "max": 10 },
        "thermal": { "value": -10 },
        "power": { "value": 5 }
      },
      "confidence": "high",
      "applicableTo": ["MacBook Pro 16 M1 Pro", "MacBook Pro 16 M1 Max", "MacBook Pro 16 M2 Pro", "MacBook Pro 16 M2 Max", "MacBook Pro 16 M3 Pro", "MacBook Pro 16 M3 Max", "MacBook Pro 16 M4 Pro", "MacBook Pro 16 M4 Max"],
      "tags": ["macbook-pro-16", "thermal-mass", "sustained-performance", "best-laptop-thermal"],
      "source": "Benchmark Testing",
      "sourceDate": "2024"
    },
    {
      "id": "mac-studio-desktop-cooling",
      "type": "synergy",
      "components": ["thermal:desktop-cooling", "cpu:apple-silicon", "gpu:apple-silicon-gpu"],
      "relationship": "Mac Studio's desktop-class cooling rarely throttles, maintaining boost clocks indefinitely under normal conditions",
      "conditions": [
        {
          "parameter": "ambient_temperature",
          "operator": "lte",
          "value": 30,
          "unit": "celsius"
        }
      ],
      "impact": {
        "performance": { "value": 10, "min": 5, "max": 15 },
        "thermal": { "value": -20 },
        "power": { "value": 15 }
      },
      "confidence": "high",
      "applicableTo": ["Mac Studio M1 Max", "Mac Studio M1 Ultra", "Mac Studio M2 Max", "Mac Studio M2 Ultra", "Mac Studio M4 Max"],
      "tags": ["mac-studio", "desktop-cooling", "sustained-performance", "no-throttle"],
      "source": "Benchmark Testing",
      "sourceDate": "2024"
    },
    {
      "id": "mac-mini-compact-thermal",
      "type": "neutral",
      "components": ["thermal:compact-active-cooling", "cpu:apple-silicon"],
      "relationship": "Mac Mini provides active cooling in compact form factor, with occasional throttling under extreme sustained loads",
      "conditions": [
        {
          "parameter": "cpu_utilization",
          "operator": "eq",
          "value": 100,
          "unit": "percent"
        },
        {
          "parameter": "workload_duration",
          "operator": "gte",
          "value": 30,
          "unit": "minutes"
        }
      ],
      "impact": {
        "performance": { "value": -10, "min": -5, "max": -20 },
        "thermal": { "value": 10 },
        "power": { "value": 5 }
      },
      "confidence": "medium",
      "applicableTo": ["Mac Mini M1", "Mac Mini M2", "Mac Mini M2 Pro", "Mac Mini M4", "Mac Mini M4 Pro"],
      "tags": ["mac-mini", "compact-cooling", "occasional-throttle"],
      "source": "Benchmark Testing",
      "sourceDate": "2024"
    },
    {
      "id": "mac-pro-maximum-cooling",
      "type": "synergy",
      "components": ["thermal:tower-cooling", "cpu:apple-silicon", "gpu:apple-silicon-gpu"],
      "relationship": "Mac Pro tower design provides maximum cooling capacity, enabling sustained maximum performance in all conditions",
      "conditions": [],
      "impact": {
        "performance": { "value": 15, "min": 10, "max": 20 },
        "thermal": { "value": -30 },
        "power": { "value": 20 }
      },
      "confidence": "high",
      "applicableTo": ["Mac Pro M2 Ultra"],
      "tags": ["mac-pro", "tower-cooling", "maximum-sustained-performance"],
      "source": "Apple Specs",
      "sourceDate": "2024"
    },
    {
      "id": "ambient-temperature-impact",
      "type": "bottleneck",
      "components": ["thermal:ambient", "cpu:apple-silicon", "gpu:apple-silicon-gpu"],
      "relationship": "High ambient temperatures (above 30C) reduce thermal headroom, causing earlier and more aggressive throttling",
      "conditions": [
        {
          "parameter": "ambient_temperature",
          "operator": "gte",
          "value": 30,
          "unit": "celsius"
        }
      ],
      "impact": {